{
  "$schema": "http://json-schema.org/draft-07/schema#",
  "$id": "https://homelab-proxmox/schemas/evidence-tfvars-proof.json",
  "type": "object",
  "title": "PROD tfvars Provisioning Proof",
  "description": "Evidence that prod.tfvars was provisioned and validated without exposing secrets",
  "properties": {
    "timestamp": {
      "type": "string",
      "format": "date-time",
      "description": "When prod.tfvars was provisioned (ISO 8601)",
      "examples": [
        "2026-01-09T08:00:00Z"
      ]
    },
    "template_source": {
      "type": "string",
      "description": "Source of template used for rendering",
      "examples": [
        "heredoc",
        "file:/path/to/template.tfvars"
      ]
    },
    "rendered_path": {
      "type": "string",
      "description": "Absolute path to rendered prod.tfvars",
      "examples": [
        "/var/lib/homelab-proxmox/tfvars/prod.tfvars"
      ]
    },
    "validation_status": {
      "type": "string",
      "enum": [
        "pass",
        "fail"
      ],
      "description": "Result of validation checks"
    },
    "token_id": {
      "type": "string",
      "pattern": "^terraform@pve!terraform-token$",
      "description": "Proxmox API token ID (non-secret, safe to include in evidence)"
    },
    "secret_present": {
      "type": "boolean",
      "description": "True if secret is non-empty and non-placeholder"
    },
    "file_hash": {
      "type": "string",
      "pattern": "^[a-f0-9]{64}$",
      "description": "SHA256 hash of rendered prod.tfvars (64 hex characters)"
    },
    "validation_errors": {
      "type": "array",
      "items": {
        "type": "string"
      },
      "description": "Validation errors if validation_status is fail (empty array if pass)",
      "default": []
    }
  },
  "required": [
    "timestamp",
    "template_source",
    "rendered_path",
    "validation_status",
    "token_id",
    "secret_present",
    "file_hash"
  ],
  "additionalProperties": false,
  "examples": [
    {
      "timestamp": "2026-01-09T08:00:00Z",
      "template_source": "heredoc",
      "rendered_path": "/var/lib/homelab-proxmox/tfvars/prod.tfvars",
      "validation_status": "pass",
      "token_id": "terraform@pve!terraform-token",
      "secret_present": true,
      "file_hash": "a1b2c3d4e5f6789012345678901234567890abcdef1234567890abcdef123456",
      "validation_errors": []
    },
    {
      "timestamp": "2026-01-09T08:00:00Z",
      "template_source": "heredoc",
      "rendered_path": "/var/lib/homelab-proxmox/tfvars/prod.tfvars",
      "validation_status": "fail",
      "token_id": "wrong-token-id",
      "secret_present": false,
      "file_hash": "0000000000000000000000000000000000000000000000000000000000000000",
      "validation_errors": [
        "Invalid token_id: expected 'terraform@pve!terraform-token', got 'wrong-token-id'",
        "Secret is empty"
      ]
    }
  ]
}
